ID,Title,Status,Owner,Authoring Company,Last Modified On,Published Channels,Expiry Date,Product Category,Focus Topics,Coach,Use Case Type,Publication Channels
UC10000258,Transition to SAP Cloud ALM,Draft,Johanna Moehlecke,SAP,"Sep 2, 2024",,,Business Technology Platform,"Integration, Artificial Intelligence, Business Transformation, Digital Transformation, RISE with SAP",Gaurav Dey,Standard,"Content Discovery, Discovery Center"
UC10000286,Enable business partner address cleansing in SAP Sales and Service Cloud,Draft,Gaurav Dey,SAP,"Sep 4, 2024",,,"CX and CRM, Business Technology Platform, Data and Analytics",Business Transformation,Gaurav Dey,Standard,"Content Discovery, Discovery Center"
UC00003907,Integrate Your SAP Ariba Tasks Into SAP Task Center,Draft,Mackenzie Moylan,SAP,"Sep 2, 2024",,,"Business Technology Platform, Application Development and Automation","Integration, User Experience",Marco Geldmacher,Standard,"Content Discovery, Discovery Center"
UC10000191,Get Started with SAP BTP Guidance Framework,Draft,Sachit Aggarwal,SAP,"Jun 29, 2024",,,Business Technology Platform,Onboarding,Sachit Aggarwal,Standard,"Content Discovery, Discovery Center"
UC10000374,Replicate Business Partners from SAP S/4HANA to Company in HubSpot,Draft,Irfan Khan,Rojo,"Nov 13, 2024",,,Application Development and Automation,,Andreas Hirche,Partner Standard,"Content Discovery, Discovery Center"
UC10000386,File Transfer from SMB to AWS and Azurestorage,Draft,Divij Balguri,Rojo,"Dec 2, 2024",,,"Business Technology Platform, Application Development and Automation",,Andreas Hirche,Partner Standard,"Content Discovery, Discovery Center"
UC10000277,Multi-Carrier Platform for Shipping,Draft,Andrej Grohar,AEB,"Aug 5, 2024",,,"Business Technology Platform, Integration, Supply Chain Logistics","Integration, Industry Solution, Sustainability, Business Transformation, Digital Transformation, Extensibility, Resilience",Andreas Hirche,Partner Standard,"Content Discovery, Discovery Center"
UC10000376,EWM with Data Analytic,Draft,Phisan Laosuwannapong,Pandora,"Nov 11, 2024",,,"Supply Chain Logistics, Supply Chain Planning, Manufacturing","Integration, Sustainability, Data to Insight, Digital Transformation, Industry 4.0",Andreas Hirche,Partner Standard,"Content Discovery, Discovery Center"
UC10000354,Build Event Driven Architecture Apps with Microsoft Azure,Draft,Uma Anbazhagan,SAP,"Oct 1, 2024",,,"Integration, Application Development and Automation",Extensibility,Marco Geldmacher,Standard,"Content Discovery, Discovery Center"
UC10000360,Replicate Products from SAP S/4HANA to Snowflake,Draft,Ashish Kuvvarapu,Rojo,"Nov 8, 2024",,,"Business Technology Platform, Application Development and Automation",,Andreas Hirche,Partner Standard,"Content Discovery, Discovery Center"
UC10000379,Replicate Business Partners from SAP S4HANA to Customers in Amazon EventBridge,Draft,Divij Balguri,Rojo,"Dec 2, 2024",,,"Business Technology Platform, Application Development and Automation",,Andreas Hirche,Partner Standard,"Content Discovery, Discovery Center"
UC10000381,(Draft) Prebuilt Adapter for the integration of a workforce planning tool into SAP,Draft,Toni Gao,EPI-USE,"Nov 19, 2024",,,"Business Technology Platform, Integration",Extensibility,Andreas Hirche,Partner Standard,"Content Discovery, Discovery Center"
UC10000359,Replicate Business Partners from SAP S/4HANA to Customers in NetSuite,Draft,Ashish Kuvvarapu,Rojo,"Nov 11, 2024",,,"Business Technology Platform, Application Development and Automation",,Andreas Hirche,Partner Standard,"Content Discovery, Discovery Center"
UC10000380,AI-Assisted User Learning Resources for Authors (AURA),Draft,Haythem OUESLATI,SAP,"Dec 6, 2024",SAP.COM,,"Artificial Intelligence, Enterprise Resource Planning, Human Capital Management, Supply Chain Management, CX and CRM, Business Technology Platform, Financial Management, Spend Management",,Oliver Stiefbold,Standard,"Content Discovery, Discovery Center"
UC10000138,APIs secured using SAP API Management with 3rd party IDP,Draft,Fiona Zhang,SAP,"Nov 19, 2024",,,"Business Technology Platform, Integration","Integration, Digital Transformation",Andreas Hirche,Standard,"Content Discovery, Discovery Center"
UC00003006,Deliver Business Outcomes by Nurturing Healthy and Happy Employees,Draft,Jana Velevska,Semos Cloud,"Feb 28, 2025",,"Feb 28, 2026","Human Capital Management, Business Technology Platform, Analytics and Planning",Business Transformation,Andreas Hirche,Partner Standard,"Content Discovery, Discovery Center"
UC00000006,Give Everyone a Voice in Your Organization with Employee Surveys,Draft,Jana Velevska,Semos Cloud,"May 28, 2024",,"Feb 28, 2026","Human Capital Management, Business Technology Platform, Analytics and Planning",Business Transformation,Andreas Hirche,Partner Standard,"Content Discovery, Discovery Center"
UC00000007,Guide Employees in Their Journey,Draft,Jana Velevska,Semos Cloud,"Feb 28, 2025",Content Discovery,"Feb 28, 2026","Human Capital Management, Business Technology Platform, Analytics and Planning",,Andreas Hirche,Partner Standard,"Content Discovery, Discovery Center"
UC00000005,Make Employee Feedback an Occasion To Look Forward To,Draft,Jana Velevska,Semos Cloud,"Feb 28, 2025",,"Feb 28, 2026","Business Technology Platform, Analytics and Planning",Business Transformation,Andreas Hirche,Partner Standard,"Content Discovery, Discovery Center"
UC00003257,Influence the Recognition and Rewards Platform,Draft,Jana Velevska,Semos Cloud,"Feb 28, 2025",,"Feb 28, 2026","Business Technology Platform, Analytics and Planning",Business Transformation,Andreas Hirche,Partner Standard,"Content Discovery, Discovery Center"
UC00004151,Drive Trust and Organizational Alignment with Employee Communications,Draft,Jana Velevska,Semos Cloud,"Feb 28, 2025",,"Feb 28, 2026","Human Capital Management, Business Technology Platform, Analytics and Planning",Business Transformation,Andreas Hirche,Partner Standard,"Content Discovery, Discovery Center"
UC00004319,Set Up Recognition Programs for Blue Collar Workers,Draft,Jana Velevska,Semos Cloud,"May 28, 2024",,"Feb 28, 2026","Human Capital Management, Business Technology Platform, Analytics and Planning",Business Transformation,Andreas Hirche,Partner Standard,"Content Discovery, Discovery Center"
UC10000280,Accelerate your BTP Journey - Future Ready Enterprise (FRE) Accelerate - Foundational Pack,Draft,Khushbu Bansal,SAP,"Mar 4, 2025",,,Business Technology Platform,"Digital Transformation, Onboarding",Oliver Stiefbold,Standard,"Content Discovery, Discovery Center"
UC10000294,Implement SAP Responsible Design and Production solution,Draft,Mireia Seron,SAP,"Mar 6, 2025",,,"Supply Chain Management, Integration","Sustainability, Business Suite, Business Transformation",Gaurav Dey,Standard,"Content Discovery, Discovery Center"
UC10000537,NTT: Improve User Adoption with an AI-Powered Feedback Assista - User Experience Feedback Assistant,Draft,Sten Frellesvig,SAP,"Mar 12, 2026",,,"Artificial Intelligence, Business Technology Platform, Integration, Application Development and Automation",User Experience,Ingo Deck,Standard,"Content Discovery, Discovery Center"
UC10000538,VALANTIC: Accelerate Analytics Development with a Business Insight Framework,Draft,Sten Frellesvig,SAP,"Mar 12, 2026",,,"Business Technology Platform, Data and Analytics, Analytics and Planning",,Ingo Deck,Standard,"Content Discovery, Discovery Center"
UC00003330,Identify Optimization Potential in the User Experience of your Business App,Draft,Cody Wedl,sovanta,"Sep 15, 2023",,"Mar 10, 2026","Business Technology Platform, Data and Analytics",,Andreas Hirche,Partner Standard,"Content Discovery, Discovery Center"
UC00003945,Accelerate Financial Planning and Analysis,Draft,James Rapp,SAP,"Dec 24, 2025",SAP.COM,"Mar 14, 2026","Enterprise Resource Planning, Business Technology Platform, Financial Management, Financial Planning and Analysis, Analytics and Planning","Data to Insight, User Experience, Business Data Cloud, Digital Transformation, RISE with SAP, Quick Account Setup, Featured",Gaurav Dey,Standard,"Content Discovery, Discovery Center"
UC10000540,Andreas' vpuc,Draft,Ingo Deck,SAP,"Mar 31, 2026",,,,,Ingo Deck,Standard,"Content Discovery, Discovery Center"
UC10000541,ATOS: Automate Digital Assurance and Testing with Generative AI - QE Assist GenAI for Digital Assura,Draft,Sten Frellesvig,SAP,"Apr 1, 2026",,,"Artificial Intelligence, Application Development and Automation",,Ingo Deck,Standard,"Content Discovery, Discovery Center"
UC10000449,Activate Joule with SAP Integrated Business Planning (IBP),Draft,Gaurav Dey,SAP,"Apr 2, 2026","Content Discovery, Discovery Center","Aug 25, 2026","Artificial Intelligence, Enterprise Resource Planning, Supply Chain Management, Business Technology Platform","Artificial Intelligence, Business AI",Gaurav Dey,Standard,"Content Discovery, Discovery Center"
UC10000402,Explore the Shift Planning Application with Seamless Scheduling and Rapid Data Synchronization,Draft,Jevgeni Vassiljev,SUCCESS-SOLUTIONS,"Apr 6, 2026",SAP.COM,,"Artificial Intelligence, Human Capital Management, Core HR and Payroll",Extensibility,Andreas Hirche,Partner Standard,"Content Discovery, Discovery Center"
UC10000543,Activate Joule with SAP Signavio Process Transformation Suite,Draft,Marvin Klose,SAP,"Apr 7, 2026",,,"Artificial Intelligence, Business Technology Platform, Business Transformation Management","Artificial Intelligence, Business AI, Business Transformation",Gaurav Dey,Standard,"Content Discovery, Discovery Center"
UC10000545,Your new use case title with maximum 80 charactersIngo Test,Draft,Ingo Deck,SAP,"Apr 9, 2026",,,,,Ingo Deck,Standard,"Content Discovery, Discovery Center"
UC10000026,Accelerate CX integration with the SAP Business Suite,Draft,James Rapp,SAP,"Apr 9, 2026",SAP.COM,"Feb 21, 2026","Supply Chain Management, CX and CRM, Business Technology Platform, Integration, Application Development and Automation","Integration, Quick Account Setup, Featured",Michael Czadankiewicz,Standard,"Content Discovery, Discovery Center"
UC10000546,Leverage government and third-party data to improve HR processes,Draft,Joanne Koh-Stewart,SAP,"Apr 9, 2026",SAP.COM,,"Artificial Intelligence, Human Capital Management, Business Technology Platform",,Ingo Deck,Standard,"Content Discovery, Discovery Center"
UC10000400,Sachit Feb25Rel Test,Draft,Sachit Aggarwal,SAP,"Apr 10, 2026",,,Artificial Intelligence,Blockchain,Sachit Aggarwal,Standard,"Content Discovery, Discovery Center"
UC00003403,Accessing data in Amazon S3 from SAP Datasphere,Draft,Sivakumar N,SAP,"Apr 12, 2026",,"Apr 11, 2026","Business Technology Platform, Data and Analytics","Integration, Data to Insight, Hyperscaler",Gaurav Dey,Standard,"Content Discovery, Discovery Center"
UC10000023,Integrate Amazon Rekognition and SAP EHS for PPE Detection,Draft,Swati Maste,SAP,"Mar 28, 2024",,"Mar 31, 2026","Application Development and Automation, Manufacturing","Sustainability, Extensibility, Industry 4.0, Hyperscaler",Gaurav Dey,Standard,"Content Discovery, Discovery Center"
UC10000393,Integrate SAP Event Mesh in SAP Signavio Process Intelligence via Action,Draft,Jonas Germann,SAP,"Apr 20, 2026",,,"Business Transformation Management, Integration","Integration, Business Transformation, Data to Insight",Gaurav Dey,Standard,"Content Discovery, Discovery Center"
UC10000395,SAP Integration Suite receives data from SAP Signavio Process Intelligence via Action,Draft,Jonas Germann,SAP,"Apr 20, 2026",,,"Business Technology Platform, Business Transformation Management, Integration","Integration, Business Transformation, Data to Insight, Digital Transformation",Gaurav Dey,Standard,"Content Discovery, Discovery Center"
UC10000548,Event & AI-Driven Supplier Risk Assessment in Procurement Contracts,Draft,Daniil Bolobonov,SAP,"Apr 21, 2026",,,"Enterprise Resource Planning, Business Technology Platform, Integration","Integration, Clean Core, Artificial Intelligence, Business AI, Business Suite, Digital Transformation, Extensibility",Michael Czadankiewicz,Standard,"Content Discovery, Discovery Center"
UC00004068,Enable Supplier Collaboration across SAP and Microsoft Azure Ecosystem using SAP BTP,Draft,Uma Anbazhagan,SAP,"Apr 12, 2026",,"Apr 21, 2027","Enterprise Resource Planning, Business Technology Platform, Application Development and Automation","User Experience, Extensibility, RISE with SAP",Marco Geldmacher,Standard,"Content Discovery, Discovery Center"
UC00003270,Gain insights to build your Cloud Native Strategy & Roadmap,Draft,Ray Gardner,HCL,"Apr 23, 2026",,,"Business Technology Platform, Integration",,Andreas Hirche,Partner Standard,"Content Discovery, Discovery Center"
UC00003273,Realise your SAP Cloud Platform Proof of Concept (PoC),Draft,Ray Gardner,HCL,"Apr 23, 2026",,,"Business Technology Platform, Application Development and Automation",,Andreas Hirche,Partner Standard,"Content Discovery, Discovery Center"
UC10000559,TEST - Use Cases Validation for Next-Gen Ariba Partner Bootcamp,Draft,Shirley Zhou,SAP,"Apr 28, 2026",,,Spend Management,User Experience,Ingo Deck,Standard,"Content Discovery, Discovery Center"
UC10000560,Arnes First missio,Draft,Katrin von Ahsen,SAP,"Apr 29, 2026",,,Business Technology Platform,,Ingo Deck,Standard,"Content Discovery, Discovery Center"
UC00003968,Get Started with SAP Cloud ALM for Operations,Draft,Johanna Moehlecke,SAP,"Apr 29, 2026",,"May 14, 2026","Business Technology Platform, Application Development and Automation","Data to Insight, Digital Transformation",Gaurav Dey,Standard,"Content Discovery, Discovery Center"
UC10000010,sachit release test,Draft,Disco Engineer,Discovery Customer,"May 5, 2026",Discovery Center,"Nov 12, 2025",Artificial Intelligence,,Sachit Aggarwal,Partner Standard,"Content Discovery, Discovery Center"
UC10000564,Akash Release Test Use Case,Draft,Akash Mishra,SAP,"May 5, 2026",,,,,Sachit Aggarwal,Standard,"Content Discovery, Discovery Center"
UC10000555,Custom AI Agents on SAP BTP,Draft,Kimay Ramnarain,SAP,"May 6, 2026",,,"Artificial Intelligence, Application Development and Automation",,Marco Geldmacher,Standard,"Content Discovery, Discovery Center"
UC10000428,Autonomous Procurement,Draft,Bertrand MOUTARDE,SAP,"May 6, 2026",,,"Artificial Intelligence, Business Technology Platform, Procurement, Integration, Sourcing and Contracts, Supplier Management",Artificial Intelligence,Marco Geldmacher,Standard,"Content Discovery, Discovery Center"
UC10000554,AI Assisted Development with Joule Studio,Draft,Kimay Ramnarain,SAP,"May 8, 2026",,,"Artificial Intelligence, Application Development and Automation",,Marco Geldmacher,Standard,"Content Discovery, Discovery Center"
UC10000530,High Availability Architecture for the UX/HANA Cloud Business Critical apps - (clean core),Draft,Dan Barton,Bluestonex,"Apr 15, 2026",,"Apr 1, 2027","Business Technology Platform, Application Development and Automation",,Andreas Hirche,Partner Standard,"Content Discovery, Discovery Center"
UC10000289,Marco Test Use Case,Draft,Marco Geldmacher,SAP,"May 12, 2026",,,"Business Technology Platform, Application Development and Automation",Artificial Intelligence,Ingo Deck,Standard,"Content Discovery, Discovery Center"
UC10000231,Leverage SAP Ariba data model in SAP Datasphere,Draft,Swen Fuchs,SAP,"Apr 13, 2026",,"Apr 25, 2026","Data and Analytics, Spend Management, Application Development and Automation",Integration,Gaurav Dey,Standard,"Content Discovery, Discovery Center"
UC00003334,Optimize Your HR & Organizational Data,Draft,Stephan Kohler,Ingentis,"Apr 24, 2026",,"Apr 30, 2026","Human Capital Management, Business Technology Platform, Analytics and Planning",,Andreas Hirche,Partner Standard,"Content Discovery, Discovery Center"
UC10000573,ABAP Cloud Learning Map,Draft,Carine Tchoutouo Djomo,SAP,"May 19, 2026",,,"Business Technology Platform, Application Development and Automation",Digital Transformation,Andreas Hirche,Standard,"Content Discovery, Discovery Center"
UC10000237,Integrating SAP Datasphere & SAP AI Core with IBM Watsonx using FedML,Draft,Alex Bishka,SAP,"Apr 13, 2026",,"May 6, 2026","Business Technology Platform, Data and Analytics","Data to Insight, Digital Transformation, Hyperscaler",Gaurav Dey,Standard,"Content Discovery, Discovery Center"
UC10000578,"Get started with SAP Integration Suite, advanced event mesh - COPY- Copy",Draft,Mark Buchakjian,SAP,"May 22, 2026",,,"Business Technology Platform, Integration, Application Development and Automation","Integration, Digital Transformation",Michael Czadankiewicz,Standard,"Content Discovery, Discovery Center"
UC10000394,How to Use Integration Suite as a Data Provider for Signavio Process Intelligence,Draft,Jonas Germann,SAP,"May 26, 2026",,,"Business Transformation Management, Integration","Integration, Business Transformation, Data to Insight, Digital Transformation",Gaurav Dey,Standard,"Content Discovery, Discovery Center"
UC10000579,Implement Next generation SAP Ariba as a Strategic Partner,Draft,Gisele Soares,SAP,"May 27, 2026",,,"Artificial Intelligence, Spend Management","Integration, Business Suite",Bettina Mussgnug,Standard,"Content Discovery, Discovery Center"
UC10000577,Find High-Potential Accounts and White-Space Opportunities with your SAP Data,Draft,Jasmin Benz,Modelyzr,"May 27, 2026",,,"Artificial Intelligence, Sales, Marketing","Artificial Intelligence, Digital Transformation, GROW with SAP, Machine Learning",Andreas Hirche,Partner Standard,"Content Discovery, Discovery Center"
UC10000580,Guilherme First Mission,Draft,Guilherme Kemmerich,SAP,"May 27, 2026",,,,,Ingo Deck,Standard,"Content Discovery, Discovery Center"
UC10000499,Activate Joule for SAP S/4HANA Private Cloud Edition,Draft,Amrita Varshini E R,SAP,"May 27, 2026",Discovery Center,"Apr 29, 2027","Artificial Intelligence, Enterprise Resource Planning, Supply Chain Management, Business Technology Platform, Business Transformation Management","Artificial Intelligence, Business AI",Gaurav Dey,Standard,"Content Discovery, Discovery Center"
UC10000261,Add Printing Label to Your User Experience for SAP S/4HANA Cloud In BTP ABAP Environment,Draft,Jacky Liu,SAP,"Aug 6, 2024",,"Jun 1, 2027","Business Technology Platform, Application Development and Automation","Sustainability, User Experience, Extensibility",Bettina Mussgnug,Standard,"Content Discovery, Discovery Center"
UC10000447,Leverage Spend Data Model in SAP Datasphere,Draft,Swen Fuchs,SAP,"Jun 2, 2026","Content Discovery, Discovery Center","Jun 1, 2027","Business Technology Platform, Spend Management, Enterprise Content Management, Procurement, Invoices and Payments, Integration, External Workforce and Services, Sourcing and Contracts, Analytics and Planning, Data Management, Supplier Management","Integration, Data to Insight, Extensibility",Gaurav Dey,Standard,"Content Discovery, Discovery Center"
UC10000228,Get Started with SAP Build Code and Joule using Generative AI (Trial Account),Draft,Christian  Kirschnick,SAP,"Apr 13, 2026",,"Feb 18, 2027","Artificial Intelligence, Business Technology Platform, Application Development and Automation","Artificial Intelligence, Extensibility, Featured, Onboarding",Oliver Stiefbold,Standard,"Content Discovery, Discovery Center"
UC10000561,Extend SAP SuccessFactors with the Semos Cloud AI Agent Suite on SAP BTP,Draft,Ivana Maznevska,Semos Cloud,"Jun 11, 2026","Content Discovery, Discovery Center, SAP.COM","May 12, 2027","Artificial Intelligence, Business Technology Platform, Data and Analytics, Integration, Application Development and Automation","Integration, Artificial Intelligence, Business AI, Data to Insight",Andreas Hirche,Partner Standard,"Content Discovery, Discovery Center"
UC10000572,Set Up SAP AI Core Generative AI Hub - Copy,Draft,Kimay Ramnarain,SAP,"Jun 16, 2026",,,Artificial Intelligence,"Artificial Intelligence, Onboarding",Oliver Stiefbold,Standard,"Content Discovery, Discovery Center"
UC10000556,Activate Joule with SAP Fieldglass,Draft,Hemanth Grandhi,SAP,"Jun 17, 2026",,,Spend Management,,Gaurav Dey,Standard,"Content Discovery, Discovery Center"
UC10000552,CAPGEMINI: Accelerate Supplier Selection with RFQ Negotiation Agent Network,Draft,Dinesh Krishnan Nair,Capgemini,"Jun 18, 2026",,,"Artificial Intelligence, Procurement, Sourcing and Contracts, Application Development and Automation","Integration, Clean Core, Artificial Intelligence, Business AI",Jaakko Kairamo,Partner Standard,"Content Discovery, Discovery Center"
UC10000539,CAPGEMINI: Order Sim Automotive - Optimize Automotive Supply Chains with Predictive Order Simulation,Draft,Dinesh Krishnan Nair,Capgemini,"Jun 18, 2026",,,"Business Technology Platform, Data and Analytics, Integration, Analytics and Planning, Application Development and Automation",,Jaakko Kairamo,Partner Standard,"Content Discovery, Discovery Center"
UC10000553,CAPGEMINI: Automate Risk-Based Dunning Across Order-to-Cash (OTC Dunning),Draft,Dinesh Krishnan Nair,Capgemini,"Jun 18, 2026",,,"Artificial Intelligence, Accounting and Financial Close, Application Development and Automation, Revenue Management","Clean Core, Artificial Intelligence, Business AI, Data to Insight",Jaakko Kairamo,Partner Standard,"Content Discovery, Discovery Center"
UC10000574,"CAPGEMINI: Agentic solution that incentivizes early payment, rationalizes credit PAYMENT TERMS AGENT",Draft,Dinesh Krishnan Nair,Capgemini,"Jun 19, 2026",,,"Business Technology Platform, Application Development and Automation",Business AI,Jaakko Kairamo,Partner Standard,"Content Discovery, Discovery Center"
UC10000587,Activate Joule with SAP Datasphere,Draft,Hemanth Grandhi,SAP,"Jun 19, 2026",,,"Artificial Intelligence, Enterprise Resource Planning, Supply Chain Management, Business Technology Platform","Artificial Intelligence, Business AI",Gaurav Dey,Standard,"Content Discovery, Discovery Center"
UC10000582,Automate Mass Document Signing Using Adobe Sign Adapter,Draft,Divij Balguri,Rojo,"Jun 19, 2026",,,"Business Technology Platform, Integration",,Andreas Hirche,Partner Standard,"Content Discovery, Discovery Center"
UC10000250,Automate Data Collection for SAP Sustainability Control Tower leveraging Process Automation,Draft,Margarethe Hilkert,sovanta,"Jul 4, 2024",,"Jun 6, 2026",Data and Analytics,"Sustainability, Data to Insight",Andreas Hirche,Partner Standard,"Content Discovery, Discovery Center"
UC10000590,Get started with SAP Build - Archive,Draft,Birgit Selbach,SAP,"Jun 22, 2026",,,"Business Technology Platform, Application Development and Automation","Integration, Clean Core, Artificial Intelligence, Business Suite, Extensibility, RISE with SAP",Bettina Mussgnug,Standard,"Content Discovery, Discovery Center"
UC10000576,Get started with SAP Build - Copy,Draft,Kimay Ramnarain,SAP,"Jun 22, 2026",,,"Business Technology Platform, Application Development and Automation","Integration, Clean Core, Artificial Intelligence, Business Suite, Extensibility, RISE with SAP",Bettina Mussgnug,Standard,"Content Discovery, Discovery Center"
UC10000550,CAPGEMINI: Automate Import Declarations with AI-Powered Document Intelligence (GTS Smart Check),Draft,Dinesh Krishnan Nair,Capgemini,"Jun 23, 2026",,,"Artificial Intelligence, Supply Chain Management, Data and Analytics, Integration, Supply Chain Logistics","Integration, Clean Core, Artificial Intelligence, Business AI",Jaakko Kairamo,Partner Standard,"Content Discovery, Discovery Center"
UC10000563,Jaakkos First Use Case,Draft,Ingo Deck,SAP,"Jun 23, 2026",,,,,Ingo Deck,Standard,"Content Discovery, Discovery Center"
UC10000583,Ingos UC Type USe Case,Draft,Ingo Deck,SAP,"Jun 23, 2026",,,Artificial Intelligence,"Autonomous Enterprise, Artificial Intelligence, Business AI",Ingo Deck,Standard,"Content Discovery, Discovery Center"
UC10000593,Ingos next use,Draft,Manjunath Baburao,SAP,"Jun 24, 2026",,,,,Ingo Deck,Standard,"Content Discovery, Discovery Center"
UC10000340,Discovery Center Target Use case Test,Draft,Akash Mishra,SAP,"Jun 25, 2026",,,"Business Technology Platform, Application Development and Automation",,Ingo Deck,Standard,"Content Discovery, Discovery Center"
UC00003700,Plug-and-Deploy a Machine Learning Model with Kyma,Draft,Feng Liang,SAP,"Jun 25, 2026","Content Discovery, Discovery Center","Apr 20, 2027","Artificial Intelligence, Enterprise Resource Planning, CX and CRM, Business Technology Platform",Artificial Intelligence,Oliver Stiefbold,Standard,"Content Discovery, Discovery Center"
UC00003067,Implement and Configure Electronic Invoicing for Italy,Draft,Christina Berardo,SAP,"Jun 29, 2026","Content Discovery, Discovery Center","Jun 11, 2027","Enterprise Resource Planning, Business Technology Platform, Integration","Integration, RISE with SAP",Michael Czadankiewicz,Standard,"Content Discovery, Discovery Center"
UC10000570,Enterprise Automation with Business Events,Draft,Kimay Ramnarain,SAP,"Jun 30, 2026",,,,,Marco Geldmacher,Standard,"Content Discovery, Discovery Center"
UC10000701,Employee Manual Q&A Agent,Draft,Partner Jarvis,All for One,"Jul 15, 2026",,,Artificial Intelligence,"Autonomous Enterprise, Artificial Intelligence",Sayan Surendran,Partner AI,"Content Discovery, Discovery Center"
UC10000702,Employee Onboarding Agents,Draft,Partner Jarvis,All for One,"Jul 15, 2026",,,Artificial Intelligence,"Autonomous Enterprise, Artificial Intelligence",Sayan Surendran,Partner AI,"Content Discovery, Discovery Center"
UC10000703,Joule Procurement Agent,Draft,Partner Jarvis,All for One,"Jul 15, 2026",,,Artificial Intelligence,"Autonomous Enterprise, Artificial Intelligence",Sayan Surendran,Partner AI,"Content Discovery, Discovery Center"
UC10000704,Learning & Development Navigator Agent,Draft,Partner Jarvis,All for One,"Jul 15, 2026",,,Artificial Intelligence,"Autonomous Enterprise, Artificial Intelligence",Sayan Surendran,Partner AI,"Content Discovery, Discovery Center"
