ID,Title,Status,Owner,Authoring Company,Last Modified On,Published Channels,Expiry Date,Product Category,Focus Topics,Coach,Use Case Type,Publication Channels
UC10001234,Extraction Agent,Draft,Partner Jarvis,Sierra Digital,"Jul 15, 2026",,,Artificial Intelligence,"Autonomous Enterprise, Artificial Intelligence",Sayan Surendran,Partner AI,"Content Discovery, Discovery Center"
UC10001235,GenXBridge – SAP BTP Neo Migration,Draft,Partner Jarvis,Sierra Digital,"Jul 15, 2026",,,Artificial Intelligence,"Autonomous Enterprise, Artificial Intelligence",Sayan Surendran,Partner AI,"Content Discovery, Discovery Center"
UC10001236,Integration Monitor – SAP Integration Suite,Draft,Partner Jarvis,Sierra Digital,"Jul 15, 2026",,,Artificial Intelligence,"Autonomous Enterprise, Artificial Intelligence",Sayan Surendran,Partner AI,"Content Discovery, Discovery Center"
UC10001237,Invoice Monitor Agent,Draft,Partner Jarvis,Sierra Digital,"Jul 15, 2026",,,Artificial Intelligence,"Autonomous Enterprise, Artificial Intelligence",Sayan Surendran,Partner AI,"Content Discovery, Discovery Center"
UC10001238,Master Data / Posting Agent,Draft,Partner Jarvis,Sierra Digital,"Jul 15, 2026",,,Artificial Intelligence,"Autonomous Enterprise, Artificial Intelligence",Sayan Surendran,Partner AI,"Content Discovery, Discovery Center"
UC10001240,Observer Agent,Draft,Partner Jarvis,Sierra Digital,"Jul 15, 2026",,,Artificial Intelligence,"Autonomous Enterprise, Artificial Intelligence",Sayan Surendran,Partner AI,"Content Discovery, Discovery Center"
UC10001242,Payout Creation Agent,Draft,Partner Jarvis,Sierra Digital,"Jul 15, 2026",,,Artificial Intelligence,"Autonomous Enterprise, Artificial Intelligence",Sayan Surendran,Partner AI,"Content Discovery, Discovery Center"
UC10001243,Procure-to-Pay Autonomous Operations,Draft,Partner Jarvis,Sierra Digital,"Jul 15, 2026",,,Artificial Intelligence,"Autonomous Enterprise, Artificial Intelligence",Sayan Surendran,Partner AI,"Content Discovery, Discovery Center"
UC10001244,Project Controls Intelligence Agent,Draft,Partner Jarvis,Sierra Digital,"Jul 15, 2026",,,Artificial Intelligence,"Autonomous Enterprise, Artificial Intelligence",Sayan Surendran,Partner AI,"Content Discovery, Discovery Center"
UC10001245,QA & Validation Agent,Draft,Partner Jarvis,Sierra Digital,"Jul 15, 2026",,,Artificial Intelligence,"Autonomous Enterprise, Artificial Intelligence",Sayan Surendran,Partner AI,"Content Discovery, Discovery Center"
UC10001246,Regulatory Reporting Agent,Draft,Partner Jarvis,Sierra Digital,"Jul 15, 2026",,,Artificial Intelligence,"Autonomous Enterprise, Artificial Intelligence",Sayan Surendran,Partner AI,"Content Discovery, Discovery Center"
UC10000112,Product Matching,Draft,Joe Lobeck,SAP,"Dec 12, 2023",,,,,SAP UCR Support,,Content Discovery
UC10000052,Select the Most Appropriate Candidates with Resume Ranking in SAP Fieldglass,Draft,Andrea Neff,SAP,"Oct 31, 2023",,,"Artificial Intelligence, Spend Management",Artificial Intelligence,SAP UCR Support,,Content Discovery
UC10000055,Match Open Receivables to Incoming Bank Statements with SAP Cash Application,Draft,Andrea Neff,SAP,"Oct 19, 2023",,,"Artificial Intelligence, Enterprise Resource Planning",Artificial Intelligence,SAP UCR Support,,Content Discovery
UC10000137,Simulating Financial Forecast Based on Price Elasticity,Draft,Joe Lobeck,SAP,"Jan 4, 2024",,,Business Technology Platform,,SAP UCR Support,,Content Discovery
UC10000288,SAP Cloud ERP Framework Onboarding Mission,Draft,Rajvir Bunet,SAP,"Jul 26, 2024",,,Enterprise Resource Planning,,SAP UCR Support,,Content Discovery
UC10000049,Detect Supply Chain Issues with Custom Alerts in SAP Integrated Business Planning,Draft,Tod Stenger,SAP,"Nov 2, 2023",,,"Artificial Intelligence, Supply Chain Management, Supply Chain Planning",Artificial Intelligence,SAP UCR Support,,Content Discovery
UC10000274,Payment Allocation Forecast,Draft,Andreas Forster,SAP,"Aug 2, 2024",,,Artificial Intelligence,Artificial Intelligence,SAP UCR Support,,Content Discovery
UC10000141,Continuous Route Optimization for Short Lead Time Deliveries,Draft,Joe Lobeck,SAP,"Jan 4, 2024",,,"Supply Chain Management, Business Technology Platform",Data to Insight,SAP UCR Support,,Content Discovery
UC00093351,Manage the COVID-19 crisis: a mobile app to identify contacts of people infected with COVID-19,Draft,Josefine Ohnesorg,SAP,"Mar 11, 2024",,,Business Technology Platform,,SAP UCR Support,,Content Discovery
UC10000103,Accelerate Process Improvement with Process change Recommender by SAP Signavio Process AI,Draft,Anubhav Khare,SAP,"Jan 5, 2024",,,Artificial Intelligence,"Artificial Intelligence, Business Transformation, Digital Transformation",SAP UCR Support,,Content Discovery
UC10000187,SAP Dynamic Pricing,Draft,Ingo Hartmann,SAP,"Feb 19, 2024",,,"Artificial Intelligence, Enterprise Resource Planning, CX and CRM, Business Technology Platform",Artificial Intelligence,SAP UCR Support,,Content Discovery
UC10000183,SAP Product Lifecycle Costing,Draft,Ingo Hartmann,SAP,"Feb 19, 2024",,,"Artificial Intelligence, Enterprise Resource Planning, Business Technology Platform",,SAP UCR Support,,Content Discovery
UC10000142,Computer Aided Ordering for Perishable Goods,Draft,Joe Lobeck,SAP,"Jan 4, 2024",,,Procurement,Data to Insight,SAP UCR Support,,Content Discovery
UC10000047,Achieve Better Process Recommendations with Process AI from SAP Signavio,Draft,Andrea Neff,SAP,"Oct 31, 2023",,,Artificial Intelligence,Artificial Intelligence,SAP UCR Support,,Content Discovery
UC10000050,Forecast Demand Accurately in SAP Integrated Business Planning for Supply Chain,Draft,Tod Stenger,SAP,"Nov 2, 2023",,,"Artificial Intelligence, Supply Chain Management, Business Technology Platform",Artificial Intelligence,SAP UCR Support,,Content Discovery
UC10000041,Scan Mobile Business Receipts with ExpenseIT in SAP Concur,Draft,Andrea Neff,SAP,"Oct 31, 2023",,,"Artificial Intelligence, Travel and Expense",Artificial Intelligence,SAP UCR Support,,Content Discovery
UC10000106,Unveiling the Dynamic Transformation: A Comparative Exploration of S/4HANA Processes,Draft,Anubhav Khare,SAP,"Jan 5, 2024",,,Artificial Intelligence,"Artificial Intelligence, Business Transformation, Digital Transformation",SAP UCR Support,,Content Discovery
UC10000140,Product Manufacturing Analytics Platform,Draft,Joe Lobeck,SAP,"Jan 4, 2024",,,Business Technology Platform,Data to Insight,SAP UCR Support,,Content Discovery
UC10000143,Augmented Analytics and Cannibalization identification for UDF,Draft,Joe Lobeck,SAP,"Jan 4, 2024",,,"Business Technology Platform, Sales, Marketing",Data to Insight,SAP UCR Support,,Content Discovery
UC10000028,S/4HANA EPPM Integration with Microsoft Project,Draft,Renato Zadro,SAP,"Oct 11, 2023",,,"Integration, Product Lifecycle Management","Integration, Extensibility",SAP UCR Support,,Content Discovery
UC10000382,Application development on BTP using the developers Guide,Draft,Srivatsan Sundararajan,SAP,"Nov 20, 2024",,,Application Development and Automation,User Experience,SAP UCR Support,,
UC10000056,Automate Extraction of Sales Orders in SAP S/4HANA Cloud,Draft,Juergen Butsmann,SAP,"Feb 6, 2024",,,"Artificial Intelligence, Enterprise Resource Planning, Financial Management",Artificial Intelligence,SAP UCR Support,,Content Discovery
UC10000057,Auto-Complete Sales Orders in SAP S/4HANA Cloud,Draft,Juergen Butsmann,SAP,"Feb 6, 2024",,,"Artificial Intelligence, Financial Management",Artificial Intelligence,SAP UCR Support,,Content Discovery
UC10000020,Monitor Cost and Schedule Performance of CAPEX Projects with S/4HANA EPPM and SAC,Draft,Renato Zadro,SAP,"Oct 2, 2023",,,"Enterprise Resource Planning, Supply Chain Management, Data and Analytics","Data to Insight, User Experience, Digital Transformation, RISE with SAP",SAP UCR Support,,Content Discovery
UC10000110,Automatic Sales Order Exception Processing,Draft,Joe Lobeck,SAP,"Dec 12, 2023",,,Business Technology Platform,,SAP UCR Support,,Content Discovery
UC10000101,Latest Goal Management - How to upgrade,Draft,Ana Chillon,SAP,"Nov 15, 2023",,,Talent Management,User Experience,SAP UCR Support,,Content Discovery
UC10000105,Unleashing Excellence: Optimizing Processes and Best Practices for S/4HANA and ECC Transformation,Draft,Anubhav Khare,SAP,"Jan 5, 2024",,,Artificial Intelligence,"Artificial Intelligence, Business Transformation, Digital Transformation",SAP UCR Support,,Content Discovery
UC10000038,"Intuitively Access How-To Information About SAP Applications with Joule, the Generative AI Assistant",Draft,Robert Mancine,SAP,"Nov 2, 2023",,,Artificial Intelligence,Artificial Intelligence,SAP UCR Support,,Content Discovery
UC10000058,Expedite Freight Verification and Documentation in SAP Transportation Management,Draft,Bill King,SAP,"Feb 6, 2024",,,"Artificial Intelligence, Supply Chain Management",Artificial Intelligence,SAP UCR Support,,Content Discovery
UC10000045,Optimize Your Supply Base with SAP Category Management,Draft,Ramanathan Gopalakrishnan,SAP,"Nov 7, 2023",,,"Artificial Intelligence, Procurement",Artificial Intelligence,SAP UCR Support,,Content Discovery
UC10000111,Market Basket Analysis,Draft,Joe Lobeck,SAP,"Dec 12, 2023",,,Business Technology Platform,Data to Insight,SAP UCR Support,,Content Discovery
UC10000115,Complaints Forecasting,Draft,Joe Lobeck,SAP,"Dec 12, 2023",,,"Business Technology Platform, Data and Analytics",,SAP UCR Support,,Content Discovery
UC10000377,Winning with Style in the Fashion Industry,Draft,Joe Lobeck,SAP,"Nov 12, 2024",,,CX and CRM,"Digital Transformation, RISE with SAP",SAP UCR Support,,Content Discovery
UC10000037,Improve Collection Processes with Predictive Scenarios in SAP Collection Management,Draft,Robin Bau,SAP,"Nov 2, 2023",,,Financial Management,Artificial Intelligence,SAP UCR Support,,Content Discovery
UC10000114,Sales Assistant for Customer Success,Draft,Joe Lobeck,SAP,"Nov 7, 2023",,,Business Technology Platform,,SAP UCR Support,,Content Discovery
UC10000042,Automate Invoice Capture in SAP Concur,Draft,Chris Roethler,SAP,"Nov 13, 2023",,,"Artificial Intelligence, Financial Management, Travel and Expense",Artificial Intelligence,SAP UCR Support,,Content Discovery
UC10000152,Automatic completion of supplier information by Gen AI,Draft,Kai Aldinger,SAP,"Jan 8, 2024",,,"Customer Service, Sales",Artificial Intelligence,SAP UCR Support,,Content Discovery
UC10000104,Revolutionizing SAP Build with Dynamic Improvement Action Recommendations,Draft,Anubhav Khare,SAP,"Jan 5, 2024",,,Artificial Intelligence,"Artificial Intelligence, Business Transformation, Digital Transformation",SAP UCR Support,,Content Discovery
UC10000204,SBN: Supplier/Manufacturer collaboration on long deal production orders,Draft,Harsh Vardhan Satsangi,SAP,"Aug 21, 2024",,,Spend Management,,SAP UCR Support,,Content Discovery
UC10000203,SBN: Exchange Production and batch Data with Suppliers,Draft,Harsh Vardhan Satsangi,SAP,"Aug 21, 2024",,,Spend Management,,SAP UCR Support,,Content Discovery
UC10000044,Increase Compliance and Reduce Maverick Spend with 360 Buying Capability in SAP Ariba Buying,Draft,Andrea Neff,SAP,"Oct 31, 2023",,,"Artificial Intelligence, Procurement",Artificial Intelligence,SAP UCR Support,,Content Discovery
UC10000054,Optimize Inventory Levels and Product Availability with SAP Predictive Replenishment,Draft,Deepak Krishna,SAP,"Nov 23, 2023",,,"Artificial Intelligence, Supply Chain Management, Supply Chain Planning",Artificial Intelligence,SAP UCR Support,,Content Discovery
UC10000039,"Speed Up Job Position Creation with Joule, the Generative AI Assistant in SAP SuccessFactors",Draft,Robert Mancine,SAP,"Nov 2, 2023",,,"Artificial Intelligence, Human Capital Management",Artificial Intelligence,SAP UCR Support,,Content Discovery
UC10000346,Ingos Test Use Case with targeting CD only,Draft,Andreas Hirche,SAP,"Feb 28, 2025",,,,,SAP UCR Support,,Content Discovery
UC10000411,Test Use Case Petra,Draft,Petra Nell,SAP,"Mar 10, 2025",,,,,SAP UCR Support,,Content Discovery
UC00092870,SBN: Enable Buyer upload of forecast via Excel - BTP Integration SBN4SC,Draft,Swen Fuchs,SAP,"Aug 21, 2024",,"Mar 14, 2026",Spend Management,Integration,SAP UCR Support,,Content Discovery
UC10000417,New Use Case for Testing -  SAP Process changes,Draft,Surya Venkatesan,SAP,"Apr 7, 2025",,,,,SAP UCR Support,,
UC10000320,Quality Complaints Analysis & Prediction,Draft,Gonzalo Hernan Sendra,SAP,"Sep 10, 2025",,,Business Technology Platform,"Artificial Intelligence, Data to Insight, Machine Learning",SAP UCR Support,,Content Discovery
UC10000011,Optimize Public Urban Transport using AI (Ingo),Draft,Ingo Deck,SAP,"Nov 18, 2025",,"May 30, 2026","Artificial Intelligence, Application Development and Automation","Artificial Intelligence, Sustainability",SAP UCR Support,,Content Discovery
UC10000509,Performance Improvement Plans,Draft,Catherine Jamieson,SAP,"Dec 3, 2025",,,Talent Management,"Business AI, User Experience",SAP UCR Support,,Content Discovery
UC00092611,ARB: Supplier Bank Account Validation - BTP Integration,Draft,Swen Fuchs,SAP,"Aug 21, 2024",Content Discovery,"Jan 7, 2027",Spend Management,,SAP UCR Support,,Content Discovery
UC10000001,Getting Started with Use Case Authoring Tool - DC Team,Draft,Sachit Aggarwal,SAP,"Feb 7, 2026",,"Sep 6, 2025","Business Technology Platform, Integration",GROW with SAP,Sachit Aggarwal,,Content Discovery
UC10000399,Improve Decision Making with Generative AI,Draft,Joanne Koh-Stewart,SAP,"Dec 16, 2025",SAP.COM,"Jan 29, 2026","Artificial Intelligence, Enterprise Resource Planning, Business Technology Platform","Artificial Intelligence, Business AI, Business Suite, Business Transformation, RISE with SAP, GROW with SAP",SAP UCR Support,,Content Discovery
UC10000418,Build enterprise GenAI apps with IBM Granite leveraging SAP AI Core & SAP HANA Cloud,Draft,Akash Amarendra,SAP,"Apr 16, 2025",,,"Artificial Intelligence, Business Technology Platform, Data and Analytics",,Gaurav Dey,Standard,"Content Discovery, Discovery Center"
UC00003974,SAP Application Extension Methodology (Draft),Draft,Marco Matha,SAP,"Apr 23, 2025",,,"Enterprise Resource Planning, Business Technology Platform, Application Development and Automation",Extensibility,Oliver Stiefbold,Standard,"Content Discovery, Discovery Center"
UC00004161,Get Started on SAP BTP Creating a Hello World App with SAPUI5Fiori Git,Draft,Andreas Hirche,SAP,"Apr 23, 2025",,,Business Technology Platform,"User Experience, Extensibility, Try for free, Onboarding",Andreas Hirche,Standard,"Content Discovery, Discovery Center"
UC10000423,Sooper Dooper Mission,Draft,Marius Dumitru,SAP,"May 6, 2025",,,,,Ingo Deck,Standard,"Content Discovery, Discovery Center"
UC10000424,New use case,Draft,Rupa Maity,SAP,"May 7, 2025",,,,,Ingo Deck,Standard,"Content Discovery, Discovery Center"
UC00003768,Oliver Test Mission (Prod),Draft,Oliver Stiefbold,SAP,"May 8, 2025",,,Business Technology Platform,Onboarding,Oliver Stiefbold,Standard,"Content Discovery, Discovery Center"
UC00003586,"Extend SAP S/4HANA Business Processes on SAP BTP, Kyma Runtime",Draft,Shankari G R,SAP,"Sep 2, 2024",Content Discovery,"May 12, 2026","Business Technology Platform, Application Development and Automation",Extensibility,Andreas Hirche,Standard,"Content Discovery, Discovery Center"
UC00003543,Assess the Disruption to Your Supply Chain Caused by Global Events,Draft,Ramesh Varsani,Cordis,"Mar 15, 2024",,"May 14, 2026","Business Technology Platform, Analytics and Planning",,Andreas Hirche,Partner Standard,"Content Discovery, Discovery Center"
UC00003521,"Gain Procurement Insights Across Sourcing, Contracts, Spend, Performance and Risk",Draft,David Whiteley,excelerateds2p,"May 14, 2025",,"Apr 11, 2026","Business Technology Platform, Data and Analytics",,Andreas Hirche,Partner Standard,"Content Discovery, Discovery Center"
UC00003520,Add a Layer of Protection to Personally Identifiable Information,Draft,Will Bunker,excelerateds2p,"May 14, 2025",,"May 14, 2026","Business Technology Platform, Integration",,Andreas Hirche,Partner Standard,"Content Discovery, Discovery Center"
UC10000440,Process Salesforce Events in SAP Integration Suite Using Pub/Sub Sender Adapter,Draft,Irfan Khan,Rojo,"May 27, 2025",,,Application Development and Automation,,Andreas Hirche,Partner Standard,"Content Discovery, Discovery Center"
UC10000454,Create an object of content-type imag,Draft,Irfan Khan,Rojo,"Jun 12, 2025",,,Application Development and Automation,,Andreas Hirche,Partner Standard,"Content Discovery, Discovery Center"
UC10000457,Activate Joule with SAP Integrated Product Development,Draft,Gaurav Dey,SAP,"Jun 16, 2025",,,"Artificial Intelligence, Business Technology Platform","Clean Core, Artificial Intelligence, Business AI",Gaurav Dey,Standard,"Content Discovery, Discovery Center"
UC10000458,Activate Joule for Digital Manufacturing,Draft,Gaurav Dey,SAP,"Jun 16, 2025",,,"Artificial Intelligence, Business Technology Platform","Clean Core, Artificial Intelligence, Business AI",Gaurav Dey,Standard,"Content Discovery, Discovery Center"
UC10000459,Activate Joule for Asset Performance Management,Draft,Gaurav Dey,SAP,"Jun 16, 2025",,,"Artificial Intelligence, Business Technology Platform","Clean Core, Artificial Intelligence, Business AI",Gaurav Dey,Standard,"Content Discovery, Discovery Center"
UC10000431,Create a Joule Skill Combining SAP and non-SAP Processes,Draft,Martin Plummer,SAP,"Jun 17, 2025",,,"Artificial Intelligence, Integration, Application Development and Automation","Integration, Artificial Intelligence, Business AI, Extensibility",Oliver Stiefbold,Standard,"Content Discovery, Discovery Center"
UC10000357,Integrate Advanced Cash Management in 4 weeks with Brisken,Draft,Dirk Neumann,Brisken,"Jul 11, 2025",,,"Financial Management, Treasury and Working Capital Management","Two-tier ERP, RISE with SAP, GROW with SAP",Andreas Hirche,Partner Standard,"Content Discovery, Discovery Center"
UC00004209,Automate Planning Approval Workflows,Draft,Patti Wachtman,Analysis Prime,"Sep 12, 2023",,"Feb 28, 2026","Business Technology Platform, Data and Analytics","User Experience, Extensibility",Andreas Hirche,Partner Standard,"Content Discovery, Discovery Center"
UC10000337,Accelerate your BTP Journey with FRE Acceleration Integration Suite Starter Pack,Draft,Jairo Canuto,SAP,"Jul 25, 2025",,,"Business Technology Platform, Integration","Integration, Onboarding",Sachit Aggarwal,Standard,"Content Discovery, Discovery Center"
UC10000419,Fusion development Scenario for private Cloud,Draft,Swathy S,SAP,"Aug 4, 2025",,,"Business Technology Platform, Integration, Application Development and Automation",,Gaurav Dey,Standard,"Content Discovery, Discovery Center"
UC10000472,Start Your SAP Cloud ALM Journey - Build a Manual Testing PoC,Draft,Amanda Arce,SAP,"Aug 12, 2025",,,Business Transformation Management,,Gaurav Dey,Standard,"Content Discovery, Discovery Center"
UC10000164,Waste Management optimization (Test purpose),Draft,Ingo Deck,SAP,"Aug 18, 2025",,,"Business Technology Platform, Application Development and Automation","User Experience, Resilience",Ingo Deck,Standard,"Content Discovery, Discovery Center"
UC10000480,2025 Ingo test switch to ExA,Draft,Ingo Deck,SAP,"Sep 10, 2025",,,"Financial Management, Application Development and Automation","User Experience, RISE with SAP",Ingo Deck,Standard,"Content Discovery, Discovery Center"
UC00004104,Get Started with SAP Datasphere,Draft,Gaurav Dey,SAP,"Sep 23, 2025",,"Feb 26, 2026","Business Technology Platform, Data and Analytics","Data to Insight, Try for free, Quick Account Setup, Featured",Gaurav Dey,Standard,"Content Discovery, Discovery Center"
UC10000136,BTP Migration Factory Cloud Journey,Draft,Milena Koenn,SAP,"Sep 23, 2025",,,"Business Technology Platform, Data and Analytics, Integration, Analytics and Planning, Application Development and Automation",,Gaurav Dey,Standard,"Content Discovery, Discovery Center"
UC10000213,Secure a Full-Stack CAP Application Following SAP BTP Developer's Guide,Draft,Ekaterina Mitova,SAP,"Oct 4, 2025",,,"Business Technology Platform, Integration, Application Development and Automation",Extensibility,Bettina Mussgnug,Standard,"Content Discovery, Discovery Center"
UC10000467,Activate Joule in SAP Datasphere,Draft,Gaurav Palekar,SAP,"Oct 7, 2025",,,Integration,,Gaurav Dey,Standard,"Content Discovery, Discovery Center"
UC10000489,Migrate integrations to cloud Architect Mindset for success,Draft,Michel Salomonsson,STRETCH,"Oct 23, 2025",,,Integration,"Integration, Digital Transformation",Andreas Hirche,Partner Standard,"Content Discovery, Discovery Center"
UC10000490,Onboard your Customers using SAP Build Process Automation,Draft,Vakeesan Meikandaan,MARK9SOLUTIONS,"Oct 25, 2025",,,Accounting and Financial Close,,Andreas Hirche,Partner Standard,"Content Discovery, Discovery Center"
UC10000500,Setup of Joule in SAP Concur - Copy,Draft,Yash .,SAP,"Nov 13, 2025",,,"Artificial Intelligence, Business Technology Platform",,Gaurav Dey,Standard,"Content Discovery, Discovery Center"
UC10000475,Transform your business with AI-powered document processing,Draft,Gaurav Dey,SAP,"Nov 18, 2025",,,"Artificial Intelligence, Business Technology Platform","Artificial Intelligence, Business AI, Data to Insight",Ingo Deck,Standard,"Content Discovery, Discovery Center"
UC10000503,FRE Acceleration Automatic Creation of Sales Orders from Excel (4G5),Draft,Sergio Racini,SAP,"Nov 19, 2025",,,"Business Technology Platform, Integration","Data to Insight, Onboarding",Sachit Aggarwal,Standard,"Content Discovery, Discovery Center"
UC10000497,Setup of Joule in SAP Concur,Draft,Yash .,SAP,"Nov 21, 2025",,,"Artificial Intelligence, Business Technology Platform",,Gaurav Dey,Standard,"Content Discovery, Discovery Center"
UC10000281,Future Ready Enterprise (FRE) Accelerate: Setup Generative AI Hub in an Enterprise Account,Draft,Khushbu Bansal,SAP,"Nov 26, 2025",,,"Artificial Intelligence, Business Technology Platform",Artificial Intelligence,Oliver Stiefbold,Standard,"Content Discovery, Discovery Center"
UC10000484,Real-Time Business Partner Onboarding with SAP Event Mesh and SAP Integration Suite (Public Cloud),Draft,Maurice Volk,Innovabee,"Nov 27, 2025",,,"Artificial Intelligence, Business Technology Platform",,Andreas Hirche,Partner Standard,"Content Discovery, Discovery Center"
UC10000415,Activate Sales Cloud V2 for GROW Premium Customers,Draft,Simon Dechent,SAP,"Nov 27, 2025",SAP.COM,,Sales,"Integration, Clean Core, Artificial Intelligence, Business AI, Business Suite, User Experience, GROW with SAP, Machine Learning",Marco Geldmacher,Standard,"Content Discovery, Discovery Center"
UC10000131,Jump-Start Your Document Processing Use Case with Generative AI,Draft,Tomasz Janasz,SAP,"Nov 27, 2025",,,"Artificial Intelligence, Business Technology Platform","Artificial Intelligence, Machine Learning",Marco Geldmacher,Standard,"Content Discovery, Discovery Center"
UC10000511,Test Lisa,Draft,Elisabeth Pilarczyk,SAP,"Dec 4, 2025",,,Enterprise Resource Planning,,Ingo Deck,Standard,"Content Discovery, Discovery Center"
UC10000512,SAP Agents,Draft,Gaurav Palekar,SAP,"Dec 10, 2025",,,Artificial Intelligence,,Ingo Deck,Standard,"Content Discovery, Discovery Center"
UC10000513,Transform Text into Automation with SAP Signavio Process AI & SAP Build Process Automation - Copy,Draft,Marc Zintel,SAP,"Dec 15, 2025",,,"Business Transformation Management, Application Development and Automation","Artificial Intelligence, New Business Models, Business Transformation, Digital Transformation",Gaurav Dey,Standard,"Content Discovery, Discovery Center"
UC10000012,Integrate Events from Amazon Monitron with SAP S/4HANA using SAP BTP and Gen AI Hub,Draft,Swati Maste,SAP,"Dec 16, 2025",,"Mar 31, 2026","Enterprise Resource Planning, Integration, Application Development and Automation","Integration, Digital Transformation, Industry 4.0, Hyperscaler",Gaurav Dey,Standard,"Content Discovery, Discovery Center"
UC10000448,Activate Document Grounding with Joule,Draft,Gaurav Dey,SAP,"Dec 16, 2025",,,"Artificial Intelligence, Business Technology Platform","Artificial Intelligence, Business AI",Gaurav Dey,Standard,"Content Discovery, Discovery Center"
UC00004264,Reduce your CO2 footprint using a smart Generative AI application on SAP BTP,Draft,Adi Pleyer,SAP,"Dec 24, 2025",,"Apr 3, 2026","Artificial Intelligence, Business Technology Platform","Artificial Intelligence, Sustainability",Gaurav Dey,Standard,"Content Discovery, Discovery Center"
UC10000450,Activate Joule with SAP Analytics Cloud,Draft,Gaurav Dey,SAP,"Dec 24, 2025",,,"Artificial Intelligence, Enterprise Resource Planning, Supply Chain Management, Business Technology Platform","Artificial Intelligence, Business AI, Data to Insight, Business Data Cloud",Gaurav Dey,Standard,"Content Discovery, Discovery Center"
UC10000229,Talent Insights with SAP Datasphere and SAP Analytics Cloud,Draft,Uma Anbazhagan,SAP,"Dec 24, 2025",,,"Data and Analytics, Travel and Expense, Core HR and Payroll, Employee Experience Management, Talent Management","Data to Insight, Business Data Cloud",Gaurav Dey,Standard,"Content Discovery, Discovery Center"
UC10000436,Accelerate your BTP Journey with FRE Acceleration Datasphere Pack Old,Draft,Alejandra Garcia,SAP,"Dec 24, 2025",,,"Business Technology Platform, Integration","Data to Insight, Business Data Cloud, Onboarding",Sachit Aggarwal,Standard,"Content Discovery, Discovery Center"
UC00003091,Get started with SAP Analytics Cloud,Draft,Gaurav Dey,SAP,"Dec 24, 2025",,"Mar 7, 2026","Business Technology Platform, Data and Analytics","Data to Insight, Business Data Cloud, Featured",Gaurav Dey,Standard,"Content Discovery, Discovery Center"
UC10000502,Extending SAP Sales and Service Cloud Version 2 using Custom Services and SAP BTP Trial (Draft),Draft,Sven Feurer,SAP,"Jan 8, 2026",,,"Customer Service, Sales",Extensibility,Marco Geldmacher,Standard,"Content Discovery, Discovery Center"
